{
  "title": "Иллюстрации - дорога! : Избранные фрагменты из книги «Год на Севере»",
  "author": "Максимов С.В.",
  "authors": [
    "Максимов С.В."
  ],
  "publisher": "Издательство TCM",
  "year": 2022,
  "isbn": "978-5-6042385-7-8",
  "udk": "39(470.1/2)",
  "bbk": "83.3,63.5",
  "annotation": "",
  "raw_ocr": "=== INFO PAGE 1 ===\nУДК 39(470.1/2)\nББК 83.3(2=411.2)53, 63.5 (231)\nM17\n\nс\n\nБИБЛИО 5\nЯ\n\nа | 5\n\nя\n\nWNROLOD =\n\nИдея Алексея Лаушкина\nВоплощение Светланы Рапенковой\nРисунки Анастасии Соротокиной\nРетушь Владимира Бурсина\n\nФинансовая поддержка Андрея Аржанова\n\nМаксимов С.В.\n\nM17 Путём-дорога! : Избранные фрагменты из книги\n«Год на Севере» / С.В. Максимов. — М.; Соловецкие\nострова: Издательство TCM, 2022. — 96 с.: ил.\n\nISBN 978-5-6042385-7-8\n\nИздание включает в себя избранные фрагменты из книги рус-\nского писателя и этнографа Сергея Васильевича Максимова «Год\nна Севере», а также фотографии конца XIX - начала ХХ в. Сергей\nМаксимов описывает своё путешествие по Беломорью в 1856 году,\nвстречи с местными жителями, дороги между населёнными пун-\nктами, рассказывает о быте и промыслах русских крестьян. Для\nширокого круга читателей. 10+\n\nНа обороте обложки фрагмент карты Н. Зуева 1860 г.\n\nУДК 39(470.1/2)\nББК 83.3, 63.5\n\n© Максимов C.B., 1984\n© Соротокина A.M., рисунки, 2022\n\nISBN 978-5-6042385-7-8 о м\n\n\n"
}